zip,sector,fullTimeEmployees,longBusinessSummary,city,phone,country,website,maxAge,address1,fax,industry,address2,symbol,compensationAsOfEpochDate
12870,Consumer Cyclical,1248.0,"PT Duta Intidaya Tbk operates as a health and beauty retailer in Indonesia. The company offers medicines, pharmacy goods, medical and wellness equipment, personal and skin care products, perfumes and cosmetics, baby products, and general merchandise in stores and/or pharmacies. It also trades in food and beverages. In addition, the company acts as an agent/representative, sole agent, distributor, and purveyor, as well as a franchise and supplier of various traded goods. As of December 31, 2021, the company operated a network of 160 stores in 14 provinces under the Watsons brand. It also operates online stores at Shopee.com, Tokopedia. com, Lazada.com, Blibli.com, and Bukalapak.com marketplace, as well as Halodoc, Bima+ app, Good Doctor app, GrabMart app, and GoMart app. The company was founded in 2005 and is based in South Jakarta, Indonesia. PT Duta Intidaya Tbk is a subsidiary of Total Alliance Holdings Limited.",South Jakarta,62 21 2128 3001,Indonesia,https://www.watsons.biz.id,86400,EightyEight@Kasablanka Tower A,62 21 2128 3002,Specialty Retail,28th and 37th Floor Jl. Casablanca Raya Kav. 88,DAYA.JK,
10220,Consumer Defensive,2161.0,"PT FKS Food Sejahtera Tbk, through its subsidiaries, engages in manufacturing, wholesale, and retail trade of food in Indonesia. The company offers dried and instant noodles and vermicelli products, wafer stick and extrusion snacks, biscuits, candies, and other snacks. It is also involved in the agriculture; supply of electricity, gas, steam, hot and cold air; and professional, scientific, and technical activities, as well as financial and insurance activities. The company was founded in 1990 and is headquartered in Central Jakarta, Indonesia. PT FKS Food Sejahtera Tbk is a subsidiary of PT Pangan Sejahtera Investama.",Jakarta Pusat,62 21 252 1698,Indonesia,https://www.fksfs.co.id,86400,Menara Astra Lantai 29,62 21 252 0798,Packaged Foods,Jl. Jend. Sudirman Kav. 5-6 Karet Tengsin Kecamatan Tanah Abang,AISA.JK,
10340,Industrials,186.0,"PT MNC Energy Investments Tbk provides commercial business flight and air transport services in Indonesia and South East Asia. The company operates various types of fixed wing aircraft and helicopters. It offers aviation services, such as aircraft and helicopter chartering, air cargo, repair shop, maintenance, and other related services. The company also provides aero medical evacuation, geophysical, and survey aerial photography, as well as air services for the development of tourism industry. It serves the onshore and offshore oil, gas, and mining companies. The company was formerly known as PT Indonesia Transport & Infrastructure Tbk and changed its name to PT MNC Energy Investments Tbk in February 2022. PT MNC Energy Investments Tbk was founded in 1968 and is headquartered in Central Jakarta, Indonesia.",Jakarta Pusat,62 21 391 2935,Indonesia,https://www.indonesia-air.com,86400,MNC Tower,62 21 391 2941,Airports & Air Services,22nd Floor JI. Kebon Sirih No. 17-19,IATA.JK,
50134,Real Estate,225.0,"PT Dafam Property Indonesia Tbk engages in the property development activities in Indonesia. The company operated through: Hotel, Sale of Residential, and Hotel Management Services divisions. It develops residential properties; and provides hotel management services. The company was incorporated in 2011 and is headquartered in Semarang, Indonesia. PT Dafam Property Indonesia Tbk is a subsidiary of Pt Dafam.",Semarang,62 24 356 9595,Indonesia,https://dafamproperty.com,86400,Menara Suara Merdeka,62 24 356 9222,Real Estate Services,11th Floor Jl. Pandanaran No. 30,DFAM.JK,
13350,Industrials,391.0,"PT Nusa Raya Cipta Tbk, together with its subsidiaries, engages in the construction business in Indonesia. The company constructs hotels and resorts, office buildings, apartments, hospitals, shopping malls, retail centers, and factories. It also engages in the construction of roads, highways, harbors, bridges, irrigation projects, and others for public and private sectors. The company was founded in 1968 and is headquartered in Jakarta, Indonesia. PT Nusa Raya Cipta Tbk is a subsidiary of PT Surya Semesta Internusa Tbk.",Jakarta,62 21 819 3526,Indonesia,https://www.nusarayacipta.com,86400,Graha Cipta Building,62 21 819 3544,Engineering & Construction,Lantai 2 Jln. D.I Panjaitan No. 40,NRCA.JK,
16810,Consumer Cyclical,1139.0,"PT Argha Karya Prima Industry Tbk manufacturers, markets, trades, and distributes flexible packaging films in Indonesia, Africa, the Americas, the Middle East, Europe, Australia, and New Zealand. It operates through two segments, Manufacturing and Distribution. It offers biaxially oriented poly propylene films and polyester films. The company was founded in 1980 and is based in Bogor, Indonesia. PT Argha Karya Prima Industry Tbk is a subsidiary of PT Nawa Panduta.",Bogor,62 21 875 2707,Indonesia,https://www.arghakarya.com,86400,Jl Pahlawan,62 21 8790 2109,Packaging & Containers,Karang Asem Barat Citeureup,AKPI.JK,
10120,Basic Materials,119.0,"PT PAM Mineral Tbk, together with its subsidiaries, engages in the exploration, mining, processing, and sale of nickel ore. The company was incorporated in 2008 and is headquartered in Jakarta Pusat, Indonesia.",Jakarta Pusat,62 21 352 1669,Indonesia,https://www.pammineral.co.id,86400,"Jl. Batu Jajar, No. 37",,Other Industrial Metals & Mining,Lantai 5,NICL.JK,
12950,Basic Materials,1.0,"PT Sumber Energi Andalan Tbk provides trading, import and export, consulting, project, and contract services to the mining and energy sectors. The company was formerly known as PT Itamaraya Tbk and changed its name to PT Sumber Energi Andalan Tbk in June 2010. The company was founded in 1987 and is headquartered in Jakarta Selatan, Indonesia.",Jakarta Selatan,62 21 5081 5254,Indonesia,https://energi-andalan.co.id,86400,Sopo Del Office & Lifestyle Tower B,62 21 5081 5253,Other Industrial Metals & Mining,"Lantai 21 JI. Mega Kuningan Barat III, Lot.10 1-6 Kawasan Mega Kuningan",ITMA.JK,
15137,Consumer Cyclical,4532.0,"PT Asia Pacific Investama Tbk, through its subsidiaries, operates as a textile and garments company in Indonesia, rest of Asia, Europe, the United States, and Africa. It operates through four segments: Garments, Weaving, Spinning, and Knitting. The company offers yarn, greige fabrics, denim fabrics, knitted fabric, and apparel. It also engages in the laundry and export businesses. The company was formerly known as PT Apac Citra Centertex Tbk and changed its name to PT Asia Pacific Investama Tbk in November 2015. The company was incorporated in 1987 and is headquartered in Tangerang, Indonesia. PT Asia Pacific Investama Tbk is a subsidiary of PT Indah Jaya Investama.",Tangerang,62 21 5566 8888,Indonesia,https://www.apinvestama.co.id,86400,Jl. Pajajaran 14 No. 62,62 21 5566 7833,Textile Manufacturing,Gandasari Jatiuwung,MYTX.JK,
12870,Industrials,163.0,"PT Intikeramik Alamasri Industri Tbk, together with its subsidiaries, manufactures, distributes, and sells porcelain tiles under the Essenza brand in Indonesia and internationally. The company operates in two segments, Ceramic Production and Sales; and Hotel Services. The company was founded in 1991 and is headquartered in Jakarta, Indonesia.",Jakarta,62 21 8370 0435,Indonesia,https://intikeramik.com,86400,"Menara Bidakara 2, Lt. 1",62 21 8370 0436,Building Products & Equipment,"Jl. Jend. Gatot Subroto, Kav. 71-73",IKAI.JK,
11740,Consumer Cyclical,3324.0,"PT Trisula International Tbk, together with its subsidiaries, designs and manufactures garments in Indonesia. It operates through four segments: Manufacturing, Distribution, Uniform, and Retail. The company manufactures garments for products, such as jackets, ladies bottom, casual wear, men's trousers, corporate uniform, and functional clothing; lower garment products and golf sportswear; and corporate uniforms for banks, hotels, governmental agencies, and airlines. It owns and operates 160 outlets; and distributes garments to department stores and retail outlets. The company also markets its products through yukshopping.com; and e-commerce platforms such as Shopee, Lazada, Zalora, Tokopedia, Blibli, Bukalapak, and JD.id. It also exports its products. The company was founded in 1968 and is headquartered in West Jakarta, Indonesia. PT Trisula International Tbk is a subsidiary of PT Trisula Insan Tiara.",Jakarta Barat,62 21 5835 7377,Indonesia,https://www.trisula.co.id,86400,Trisula Center,62 21 5835 8033,Apparel Manufacturing,"Blok A,No. 1 Jl. Lingkar Luar Barat, Rawa Buaya Cengkareng",TRIS.JK,
12190,Basic Materials,425.0,"PT Central Omega Resources Tbk, together with its subsidiaries, engages in the mineral mining business in Indonesia. It explores for nickel ores. The company was formerly known as PT Duta Kirana Finance Tbk and changed its name to PT Central Omega Resources Tbk in 2008. The company was founded in 1995 and is headquartered in Jakarta, Indonesia. PT Central Omega Resources Tbk operates as a subsidiary of PT Jinsheng Mining.",Jakarta,62 21 515 3533,Indonesia,https://www.centralomega.com,86400,Plaza Asia,62 21 515 3753,Other Industrial Metals & Mining,6th Floor Jl. Jendral Sudirman Kav. 59,DKFT.JK,
76116,Industrials,206.0,"PT Transkon Jaya Tbk engages in vehicle rental services in Indonesia. The company rents light vehicles, light trucks and buses, manhauls, ambulance, service bodies, rescue vehicles, and other specialist vehicles, as well as trades in spare parts and car accessories. It also provides internet and communications; and IT and computer services. The company serves mining, oil and gas, catering, and construction industries. The company was founded in 2002 and is based in Balikpapan, Indonesia.",Balikpapan,62 54 277 0401,Indonesia,https://transkon-rent.com,86400,Jl. Mulawarman No.21 RT.23,62 54 277 0403,Rental & Leasing Services,Manggar,TRJA.JK,
12950,Energy,108.0,"PT Golden Eagle Energy Tbk, together with its subsidiaries, engages in the coal mining and related activities in Indonesia. The company owns interests in a coal mining concession that covers an area of 3,238 hectares located in District Palaran, Samarinda, East Kalimantan; and coal concessions covering 2,143 hectares located in North Musi Rawas Regency, South Sumatera province. It offers mining support and coal transportation services. The company is also involved in exporting activities. The company was formerly known as PT Eatertainment International Tbk and changed its name to PT Golden Eagle Energy Tbk in August 2012. PT Golden Eagle Energy Tbk was founded in 1980 and is based in Jakarta, Indonesia. PT Golden Eagle Energy Tbk is a subsidiary of PT Mutiara Timur Pratama.",Jakarta,62 21 576 1815,Indonesia,https://www.go-eagle.co.id,86400,Menara Rajawali,62 21 576 1817,Thermal Coal,7th Floor Jl. Dr. Ide Anak Agung Gde Agu Lot No5.1 Kawasan Mega Kuningan,SMMT.JK,
12430,Consumer Cyclical,489.0,"PT Sepatu Bata Tbk. engages in the manufacture and sale of footwear products in Indonesia. The company offers leather footwear, canvas built-up footwear, casual and sports shoes, injection molded sandals/slippers, and industrial safety footwear. It is also involved in the import, export, and distribution of footwear. The company offers its products through stores, as well as online. It serves retail dealers and wholesalers. The company was founded in 1931 and is headquartered in South Jakarta, Indonesia. PT Sepatu Bata Tbk. operates as a subsidiary of Bafin (Nederland) B.V.",Jakarta Selatan,62 21 750 5353,Indonesia,https://www.bata.co.id,86400,Jl. RA. Kartini Kav. 28,62 21 750 4354,Footwear & Accessories,Cilandak Barat,BATA.JK,
,Real Estate,4.0,"PT Andalan Perkasa Abadi Tbk develops and manages properties in Indonesia. Its property portfolio comprises apartments and villas. The company was formerly known as PT Gatra Wibawa Sejati and changed its name to PT Andalan Perkasa Abadi Tbk in 2016. PT Andalan Perkasa Abadi Tbk was founded in 2014 and is headquartered in Bali, Indonesia.",Bali,62 361 849 9595,Indonesia,https://www.andalanperkasaabadi.co.id,86400,Jalan Raya Cendrawasih No. 88A,62 361 849 9595,Real Estate Services,"Kerobokan Kelod, Kuta Utara Kabupaten Badung",NASA.JK,
,Energy,68.0,"PT Alfa Energi Investama Tbk, through its subsidiaries, engages in the coal mining, trading, and transportation businesses in Indonesia. It is also involved in the stockpile management, crushing, and loading of coal. The company holds interests in a concession with approximately 2,089 hectares located in Kutai Kartanegara, East Kalimantan; and a concession with approximately 6,000 hectares situated in West Kutai, East Kalimantan. PT Alfa Energi Investama Tbk was founded in 2015 and is based in Jakarta Selatan, Indonesia.",Jakarta Selatan,62 21 724 6966,Indonesia,https://www.alfacentra.com,86400,Plaza 5 Pondok Indah,62 21 7278 0115,Thermal Coal,"Blok D-12,Jl. Margaguna Raya RT.03/RW.11 Gandaria Utara Kebayoran Baru",FIRE.JK,
11850,Industrials,300.0,"PT Tembaga Mulia Semanan Tbk manufactures, sells, and exports copper and aluminum rods and wires in Indonesia and internationally. It operates in two segments, Copper Rod and Wire, and Aluminum Rod. The Copper Rod and Wire segment produces copper rods and various sizes of copper wires. The Aluminum Rod segment produces EC grade rods, alloy rods, and TAL rods. The company was incorporated in 1977 and is based in Jakarta Barat, Indonesia.",Jakarta Barat,62 21 619 0128,Indonesia,https://www.pttms.co.id,86400,Jalan Daan Mogot Km. 16,62 21 619 0135,Metal Fabrication,Semanan Kalideres,TBMS.JK,
15111,Industrials,6.0,"PT Pratama Widya Tbk provides construction services in the areas of geotechnical engineering. The company's services include geotechnical investigation; deep foundations, such as bored pile, piling, injection pile, and loading test; retaining walls, such as soldier and contiguous pile, sheet pile, secant pile, and diaphragm wall works; grouting and soil improvements consisting of jet grouting, deep mixing, and soil cement stabilization works; slope reinforcement comprising soil nailing and shotcrete, ground anchor, and rock bolt works, as well as dewatering services; and engineering procurement construction works. It serves various development sectors, such as buildings, infrastructures, mining sites, factories, oil and gas sectors, dams, powerplants, and others. The company was founded in 1981 and is headquartered in Tangerang, Indonesia.",Tangerang,62 21 5578 2407,Indonesia,https://www.pratamawidya.com,86400,Widya Griya,62 62 5570 1567,Engineering & Construction,Jalan Kepala Buaran PLN No.92 A-D Cikokol,PTPW.JK,
12950,Financial Services,652.0,"PT Buana Finance Tbk provides investment, consumer, working capital, and multipurpose financing services in Indonesia. The company operates through Finance Lease Receivables and Consumer Financing Receivables segments. It offers financing services for various products, including heavy equipment, such as excavators, wheel loaders, tractors, and heavy trucks; generator and forklifts; printing and industrial machineries; consumer cars and commercial vehicles (trucks); vessels; Hajj/Umrah; education; tour traveling/vacation; and others, as well as sale and leaseback services. The company also provides working capital financing, which include factoring; multipurpose financing comprising finance lease and installment finance; and investment financing that cover financing facilities for procurement of capital goods, as well as services to individuals, business entities, or legal entities for the modernization and expansion of businesses/investment. It serves customers through its network of 33 branches in Jabodetabek, Java, Sumatera, Bali, Kalimantan, Sulawesi, and Papua. The company was founded in 1982 and is headquartered in Jakarta, Indonesia. PT Buana Finance Tbk is a subsidiary of PT Sari Dasa Karsa.",Jakarta,62 21 5080 6969,Indonesia,https://www.buanafinance.co.id,86400,Tokopedia Tower – Ciputra World 2,62 21 5080 6996,Credit Services,"38th Floor Unit A-F, Jl. Prof. Dr. Satrio, Kav. 11",BBLD.JK,
12920,Industrials,141.0,"PT Batavia Prosperindo Trans Tbk operates as a transportation services company in Indonesia. It offers long-term and short-term vehicle rental and fleet management services. The company was founded in 2014 and is based in Central Jakarta, Indonesia. PT Batavia Prosperindo Trans Tbk is a subsidiary of PT Batavia Prosperindo Makmur.",Jakarta Pusat,62 21 520 0434,Indonesia,https://www.bataviarent.com,86400,Chase Plaza,62 21 570 6413,Rental & Leasing Services,12th Floor Jalan Jenderal Sudirman Kav. 21,BPTR.JK,
10160,Real Estate,112.0,"PT Bukit Darmo Property Tbk engages in the construction, development, trade, and investment activities in Indonesia. It operates through Real Estate, Shopping Mall, Construction, and Marketing Services segments. The company constructs and develops apartments, offices, shops, recreational parks, tourism destinations, and related facilities; and establishes and runs service bureaus for various activities, such as promotion, management, marketing, land selling, and purchase of buildings, apartments, offices, shops, recreational parks, restaurants, and tourism destinations. It also designs, constructs, and maintains housing properties, hotels, apartments, offices, shops, and recreational parks, as well as tourism destinations, including restaurants, golf courses, and associated facilities. The company was formerly known as PT Adhibaladika and changed its name to PT Bukit Darmo Property Tbk in April 2007. The company was founded in 1989 and is headquartered in Jakarta Pusat, Indonesia.",Jakarta Pusat,62 21 351 7007,Indonesia,https://www.bukitdarmoproperty.com,86400,Jalan Tanah Abang III No.6,62 21 351 7008,Real Estate Services,"RT.1/RW.8, Petojo Selatan Kecamatan Gambir Kota",BKDP.JK,
12190,Consumer Defensive,1002.0,"PT Sekar Bumi Tbk processes, produces, trades in, and distributes frozen food products in Indonesia. The company offers block packing, raw, and cooked shrimp, as well as cooked and peeled prawns; beef balls, sea food, fish balls, fish shiumai, hakau, kekian, martabak, mini wonton, nuggets, puffs, samosa, sausage, shiumai, shrimp balls, shrimp shiumai, spring rolls, and squid balls; and cheese and vegetable fish cake, brosur bumifood, dumpling ayam and udang, fish tofu, fish cake laksa recipe, scallop, shrimp and fish dumpling, and shumai. It also processes cashew nuts and other nut products; and bread crumbs and breaded shrimps. In addition, the company is involved in the agriculture, fisheries, aquaculture, trading, transportation, construction, services, printing, and workshop businesses. PT Sekar Bumi Tbk sells its products under the FINNA, SKB, Bumifood, and Mitraku brands. The company also exports its products to the United States, Europe, Japan, and other Asian countries. PT Sekar Bumi Tbk was founded in 1968 and is headquartered in Jakarta Selatan, Indonesia.",Jakarta Selatan,62 21 5140 1122,Indonesia,https://www.sekarbumi.com,86400,Plaza Asia,62 21 5140 1212,Packaged Foods,21st Floor Jl. Jend. Sudirman Kav. 59,SKBM.JK,
10730,Basic Materials,147.0,"PT Saranacentral Bajatama Tbk engages in manufacturing and trading of steel products in Indonesia. The company operates through four segments: Galvanized, Saranalume, Colouring, and Non Production. It offers galvanized coated steel, aluminum zinc-coated steel, and painted zinc-coated steel products. The company markets its products under the SARAN brand. Its products are used in various applications, including building and construction; electrical and machinery; motor vehicles; office and equipment; and others, as well as residential, industrial, and commercial roofing and cladding; and curve roofing. The company was founded in 1993 and is headquartered in Jakarta Pusat, Indonesia.",Jakarta Pusat,62 21 628 8647,Indonesia,https://www.saranacentral.com,86400,Gedung Baja,62 21 601 1933,Steel,"9th Floor Tower B, Lantai 6 Jl. Pangeran Jayakarta No. 55",BAJA.JK,
11410,Real Estate,3.0,"PT Agung Semesta Sejahtera Tbk primarily engages in the development of real estate properties in Indonesia. It develops apartment, residential, housing area, shophouse, and modern market projects. The company was formerly known as PT Sitara Propertindo Tbk and changed its name to PT Agung Semesta Sejahtera Tbk in August 2020. PT Agung Semesta Sejahtera Tbk was founded in 2006 and is headquartered in West Jakarta, Indonesia.",West Jakarta,62 21 5367 3076,Indonesia,https://www.agungsemestasejahtera.com,86400,Wisma 77 Lt. 19,,Real Estate—Diversified,Jl. Lt. Gen. S. Parman Kav. 77 Ex. Slipi Kec. Palmerah,TARA.JK,
12930,Consumer Cyclical,3.0,"PT Argo Pantes Tbk produces and sells various textile products primarily in Indonesia. The company is involved in the warehouse and office rental activities. PT Argo Pantes Tbk was incorporated in 1977 and is headquartered in South Jakarta, Indonesia.",Jakarta Selatan,62 21 252 0065,Indonesia,https://www.argopantes.com,86400,Wisma Argo Manunggal,62 21 252 0108,Textile Manufacturing,2nd Floor Jalan Jend. Gatot Subroto Kav. 22,ARGO.JK,
12190,Financial Services,46.0,"PT Minna Padi Investama Sekuritas Tbk engages in the securities brokerage and underwriting activities in Indonesia. It provides brokerage services for equity and fixed income securities in primary and secondary market; underwriting services for initial public offerings, right issues, and bonds; and financial advisory services. The company was formerly known as PT Minna Padi Investama Tbk and changed its name to PT Minna Padi Investama Sekuritas Tbk in March 2017. PT Minna Padi Investama Sekuritas Tbk was founded in 1998 and is headquartered in Jakarta, Indonesia.",Jakarta,62 21 525 5555,Indonesia,https://www.minnapadi.com,86400,Equity Tower,62 21 527 1527,Asset Management,11th Floor Sudirman Central Business Dist. Lot. 9 Jl. Jenderal Sudirman Kav. 52-53,PADI.JK,
12950,Consumer Cyclical,16.0,"PT Yanaprima Hastapersada Tbk manufactures and exports polypropylene (PP) and polyethylene woven bags in Indonesia, rest of Asia, and internationally. The company operates through Plastic Bags, Cement Bags, Roll Sheet and Sandwich Sheet, and Others segments. It provides cement bags, block-bottom bags, laminated woven bags, resin bags, and PP woven fabrics for packing semi-finished products. The company was founded in 1995 and is headquartered in Jakarta Selatan, Indonesia. PT Yanaprima Hastapersada Tbk is a subsidiary of PT Hastagraha Bumipersada.",Jakarta Selatan,62 21 526 1172,Indonesia,https://www.yanaprima.com,86400,Gedung Graha Irama,,Packaging & Containers,"Lantai 2-E Jl. HR. Rasuna Said Blok X-1 Kav 1-2, Kuningan Timur",YPAS.JK,
15334,Consumer Cyclical,609.0,"PT Gema Grahasarana Tbk operates as an interior contractor and furniture manufacturer in Indonesia and internationally. The company operates through Interior, Furniture and Mechanical Electrical; Laminate; Furniture and Supplies; and Interior and Furniture Component Distribution segments. It offers interior fit-outs, furniture and panel manufacturing, mechanical and electrical installation, maintenance, and logistics. The company also manufactures and sells customized, modular, home and office, and hospitality furniture. In addition, it provides mechanical, electrical, data, and voice installation services. Further, the company is involved in trading laminated material interior and furniture; house, and office furniture and equipment; and interior and furniture components. It serves banking and financial, mining and energy, retail and hospitality, and multinational company and other sectors. The company was founded in 1984 and is headquartered in Tangerang, Indonesia. PT Gema Grahasarana Tbk is a subsidiary of PT Virucci Indogriya Sarana.",Tangerang,62 21 5098 6988,Indonesia,https://ggs-interior.vivere.co.id,86400,SOUTH78,,"Furnishings, Fixtures & Appliances","9th –11th Floor Jl. Boulevard Gading Serpong Blok O No. 7 & 8, Gading Serpong",GEMA.JK,
12950,Real Estate,110.0,"PT Megapolitan Developments Tbk operates as a property development company in Indonesia. The company engages in the development of shopping centers, housing projects, commercial shop houses, and shopping and business centers, as well as residential areas and apartments. It is also involved in renting properties and sale of land. The company was formerly known as PT Megapolitan Developments Corporation and changed its name to PT Megapolitan Developments Tbk in 2010. PT Megapolitan Developments Tbk was founded in 1976 and is headquartered in Jakarta, Indonesia. PT Megapolitan Developments Tbk is a subsidiary of PT. Cosmopolitan Persada Developments.",Jakarta,62 21 3001 9938,Indonesia,https://www.megapolitan-group.com,86400,The Bellagio Residence & Mall,62 21 3001 9939,Real Estate Services,Jl.Kawasan Mega Kuningan Barat Kav.E4 No. 3 Kuningan Timur Setiabudi,EMDE.JK,
43158,Consumer Defensive,229.0,"PT Tri Banyan Tirta Tbk engages in the manufacture and sale of bottled mineral and flavored water under the Alto and Total brand names in Indonesia. It also sells alkaline water products under the Total 8- + brand name. In addition, the company operates as an original equipment manufacturer of bottled VIT products. It serves plastic packaging, food, beverages, and canning/bottling, soft drink, and drinking and mineral water industries. The company was incorporated in 1997 and is headquartered in Sukabumi, Indonesia. PT Tri Banyan Tirta Tbk is a subsidiary of PT Fikasa Bintang Cemerlang.",Sukabumi,62 26 673 5813,Indonesia,https://www.altospringswater.com,86400,Kampung Pasir Dalem,62 26 673 1319,Beverages—Non-Alcoholic,"RT. RW: 002/002, Babakan Pari Cidahu District",ALTO.JK,
