zip,sector,fullTimeEmployees,longBusinessSummary,city,phone,country,website,maxAge,address1,fax,industry,address2,symbol,compensationAsOfEpochDate
16161,Consumer Cyclical,846.0,"PT Goodyear Indonesia Tbk manufactures, imports, exports, and distributes tires, inner tubes, flaps, and other rubber derivative products for automobiles, and airplanes and related components. As of December 31, 2021, it collaborates with approximately 62 Autocare outlets in Indonesia. The company was formerly known as NV The Goodyear Tire & Rubber Company Limited and changed its name to PT Goodyear Indonesia Tbk in July 1978. The company was founded in 1917 and is headquartered in Bogor, Indonesia. PT Goodyear Indonesia Tbk is a subsidiary of The Goodyear Tire & Rubber Company.",Bogor,62 25 1832 2071,Indonesia,https://www.goodyear-indonesia.com,86400,"JL. Pemuda, No. 27",62 25 1832 8088,Auto Parts,"Tanah Sareal, RT.01/RW.07 Kb. Pedes Kec. Tanah Sareal",GDYR.JK,
14430,Industrials,,"PT Kobexindo Tractors Tbk, together with its subsidiaries, engages in the distribution and servicing of heavy equipment in Indonesia. The company operates through Heavy Equipment, Spare Parts, Repair Services and Mining Contracting, and Building and Heavy Equipment Rental segments. It offers excavators, hydraulic breakers, articulated dump trucks, rigid dump trucks, heavy duty on and off-road trucks, and wheel loaders; diesel-powered forklifts; diesel and electric forklifts, hand pallets, hand stackers, racks, and sweeping and scrubber machines; and after sales services, as well as supplies spare parts. The company also provides maintenance and rental services for heavy equipment; and engages in the rental of office building. It markets and distributes heavy equipment for mining, agriculture and plantation, construction, and forestry industries; and serves warehousing and logistics business, and manufactures. The company was founded in 2002 and is headquartered in North Jakarta, Indonesia. PT Kobexindo Tractors Tbk is a subsidiary of PT Kobexindo Investama.",Jakarta Utara,62 21 6470 0800,Indonesia,https://www.kobexindo.com,86400,Kobexindo Tower,62 21 6470 0900,Farm & Heavy Construction Machinery,Jalan Pasir Putih Raya Blok E-5-D Ancol Pademangan,KOBX.JK,
12920,Healthcare,960.0,"PT Pyridam Farma Tbk develops, produces, and sells pharmaceuticals, antibiotics, vitamins, supplements, and traditional herbal care products in Indonesia. The company operates in two segments, Pharmaceutical Products and Toll Manufacturing Services; and Medical Device Products. It offers medical instruments and equipment, including clinical waste, collection swab, collection tube, innerbox DCA, KF94 mask, parafilm, PCR  extraction kit and extractor machine, speciment bag, sterile container, and tube stopper. The company also provides skin care products comprising Arosa gel, A-Stark Gel, Hymen gel, Pyderen Emulsion, Tonic Bust Emulsion, Calmosan Cream, and Di-Herb gel; products in the areas of alimentary t. and metabolism, blood and blood forming organs, cardiovascular system, dermatologicals, G.U. system and sex hormones, systemic corticosteroids, systemic antibacterial, sensory organs, as well as musculo-skeletal, nervous, and respiratory systems; and supplements and other preventive consumer health products with energy drinks and healthy ready-to-drink products. In addition, it engages in the research and development on biotechnology, life, and medical science. The company was founded in 1976 and is headquartered in Jakarta, Indonesia.",Jakarta,62 21 5099 1067,Indonesia,https://www.pyfa.co.id,86400,Sinarmas MSIG Tower,,Drug Manufacturers—Specialty & Generic,"12th Floor Jl. Jend. Sudirman No.Kav. 21 RT.10/RW.01,Kuningan, Karet, Kecamatan S",PYFA.JK,
10340,Industrials,13.0,"PT Mitra Investindo Tbk engages in the exploration and production of crude petroleum and gas in Indonesia. It also provides vessel chartering, ship management, and shipping agency services. The company was formerly known as PT Siwani Trimitra Tbk and changed its name to PT Mitra Investindo Tbk in March 2006. PT Mitra Investindo Tbk was founded in 1993 and is headquartered in Jakarta, Indonesia.",Jakarta,62 21 2907 9558,Indonesia,https://www.mitra-investindo.com,86400,Jalan Menteng Raya No.72,,Marine Shipping,"RT.4/ RW.9, Dukuh Atas Kebon Sirih, Menteng District Central Jakarta City",MITI.JK,
12740,Real Estate,6.0,"PT Repower Asia Indonesia Tbk engages in the real estate property business in Indonesia. The company purchases, sells, leases, and operates real estate properties, such as apartment buildings, residential buildings, exhibition grounds, personal storage facilities, malls, shopping centers, and others. The company was founded in 2011 and is headquartered in South Jakarta, Indonesia.",South Jakarta,62 21 2503 3198,Indonesia,https://repowerasiaindonesia.com,86400,Graha Repower Asia building,62 21 2503 3399,Real Estate—Development,Jalan Warung Buncit Raya No. 65,REAL.JK,
11180,Consumer Cyclical,1025.0,"PT Pudjiadi and Sons Tbk operates hotels and hotel facilities in Indonesia. Its facilities include accommodation, offices, shopping complexes, apartments, recreational facilities, and entertainment facilities. The company is also involved in the property management and catering businesses. It operates hotels in Jakarta, Bandung, Anyer, Cisarua, Bali, Lombok, Yogyakarta, and Flores. The company was incorporated in 1970 and is based in Jakarta, Indonesia. PT Pudjiadi and Sons Tbk is a subsidiary of PT Istana Kuta Ratu Prestige.",Jakarta,62 21 659 3626,Indonesia,https://www.pudjiadiandsons.co.id,86400,Hotel The Jayakarta S.P.,62 21 639 9573,Resorts & Casinos,Jl. Hayam Wuruk No. 126 Lantai 21,PNSE.JK,
14430,Consumer Defensive,604.0,"Pt Wicaksana Overseas International Tbk engages in the distribution and trading of food, beverage, and other products in Indonesia. The company operates through two segments, Distribution and Trading Centre. It offers snacks, beverages, milk powder, instant noodles, personal care products, cosmetics, medicines, household products, cooking oil, and plastic and electrical materials, as well as over the counter and consumer health products, and medical devices. The company also provides patient, commercial, regulatory support, and distribution services. It operates through a network of 33 distribution centers. The company was founded in 1973 and is headquartered in Jakarta Utara, Indonesia. Pt Wicaksana Overseas International Tbk is a subsidiary of DKSH Holding AG.",Jakarta Utara,62 21 692 7293,Indonesia,https://www.wicaksana.co.id,86400,Jalan Ancol Barat VII,62 21 692 7766,Food Distribution,Blok A5D No. 2,WICO.JK,
16820,Technology,162.0,"PT Selaras Citra Nusantara Perkasa Tbk produces and sells household appliance products and medical devices in Indonesia. It offers blenders, electric irons, gas stoves, electric fans, and air purifiers, as well as UVC sterilizer cabinets. The company is headquartered in Bogor, Indonesia. PT Selaras Citra Nusantar Perkasa Tbk is a subsidiary of PT Sena Dwimakmur.",Bogor,62 21 823 3320,Indonesia,https://www.scnp.co.id,86400,Dusun Pasir Angin RT. 003 RW. 004,62 21 823 0232,Consumer Electronics,Pasir Angin Raya Narogong Km. 19 Cileungsi,SCNP.JK,
61177,Basic Materials,228.0,"PT Emdeki Utama Tbk produces and sells calcium carbide in Indonesia. The company also produces air conditioners and refrigerators. It exports calcium carbide to Japan, the United States, India, and other countries. The company was founded in 1981 and is headquartered in Gresik, Indonesia. PT Emdeki Utama Tbk is a subsidiary of PT Emde Industri Investama.",Gresik,62 31 750 7001,Indonesia,https://www.emdeki.co.id,86400,Jl. Raya Krikilan No. 294,62 31 750 7234,Specialty Chemicals,"RT 011/002, Krikilan Driyorejo",MDKI.JK,
12960,Industrials,13.0,"PT Bintang Samudera Mandiri Lines Tbk provides sea transportation and logistics services in Indonesia. It transports mining commodities, such as coal and nickel; infrastructure goods, including cement, sand, pipes, and construction equipment; and fertilizers and clinkers. The company offers shipping agency; bunkering; loading and unloading; and refueling services, as well as ramp door and trestle rental services. It also provides transportation facilities for picking up and loading cargo on barges; charter ship operation services for the delivery of cargo for mining goods and others; marine ship operation management services; and logistics services for vessels and sea loading activities. It operates 8 units of tugboats and 7 units of barges. The company was founded in 2012 and is based in Jakarta Selatan, Indonesia.",Jakarta Selatan,62 21 2232 3392,Indonesia,https://bsmlines.com,86400,Rasuna Office Park No. DO-03,,Marine Shipping,Jl. Taman Rasuna Timur Kecamatan Menteng Atas Kelurahan Setiabudi,BSML.JK,
