zip,sector,fullTimeEmployees,longBusinessSummary,city,phone,country,website,maxAge,address1,fax,industry,address2,symbol,compensationAsOfEpochDate
14430,Consumer Cyclical,708.0,"PT Pembangunan Jaya Ancol Tbk, together with its subsidiaries, manages tourist area, travel show, and lodging areas in Indonesia. It operates through three segments: Tourism; Real Estate; and Trading and Services. The company manages entrance gates, recreational parks and beaches, fantasy world, swimming pool, animal shows, and lodging facilities, as well as engages in merchandise selling activities. It also develops, sells, and rents various real estate properties. In addition, the company is involved in souvenirs trading, marine transportation, and restaurant management activities; the purification, management, drainage, supply, and distribution of clean water; and the provision of highway construction and services, and consulting services. PT Pembangunan Jaya Ancol Tbk was founded in 1966 and is headquartered in Jakarta Utara, Indonesia.",Jakarta Utara,62 21 645 4567,Indonesia,https://www.ancol.com,86400,Ecovention Building - Ecopark,62 21 647 10502,Leisure,Jalan Lodan Timur No 7 Ancol Taman Impian Pademangan District,PJAA.JK,
10220,Consumer Cyclical,25.0,"PT Hotel Sahid Jaya International Tbk engages in the hotel and accommodation businesses in Indonesia. It also leases facilities related to the hotel business; and offers management and other services for hotel and tourism sectors. The company was founded in 1969 and is headquartered in Jakarta, Indonesia. PT Hotel Sahid Jaya International Tbk is a subsidiary of PT Empu Sahid International.",Jakarta,62 21 570 2431,Indonesia,https://www.pthsji.com,86400,Sahid Annex Building,62 21 570 2299,Lodging,"2nd Floor Southwing Jalan Jenderal Sudirman, No. 86",SHID.JK,
10220,Consumer Cyclical,8.0,"PT Arthavest Tbk, together with its subsidiaries, engages in the hospitality business in Central Jakarta. The company owns and operates the Redtop hotel & convention center, a 4-star business hotel with 390 rooms. Its Redtop hotel offers convention and banquet, meeting rooms, and business center, as well as sports center and spa. The company also provides information technology and payment system services, as well as sells computer hardware and software. The company was formerly known as PT Artha Securities Tbk. PT Arthavest Tbk was founded in 1990 and is based in Jakarta Pusat, Indonesia. PT Arthavest Tbk is a subsidiary of Lucas SH CN.",Jakarta Pusat,62 21 3111 6101,Indonesia,https://www.arthavest.com,86400,Sahid Sudirman Center,,Lodging,55th Floor Jl.Jend.Sudirman no.86,ARTA.JK,
15137,Industrials,863.0,"PT Jembo Cable Company Tbk manufactures and sells various wires and cables in Indonesia and internationally. It operates through Power Cable, Telephone Cable, and Others segments. The company provides low and medium voltage copper and aluminum cables; overhead transmission and distribution; telecommunication cables with copper and optic fiber conductors; instrumentation cables; control cables; airfield lighting cables; metal corrugated armoured cables; marine offshore cables; fire resistant and flame retardant cables; lead sheathed cables; and HDPE pipes and related equipment. It is also involved in the maintenance and repair of electrical and other communication network; and construction of pipe network for oil and gas. PT Jembo Cable Company Tbk was incorporated in 1973 and is headquartered in Tangerang, Indonesia. PT Jembo Cable Company Tbk is a subsidiary of PT Monaspermata Persada.",Tangerang,62 21 591 9442,Indonesia,https://www.jembo.co.id,86400,Jl. Pajajaran,62 21 5565 0466,Electrical Equipment & Parts,Kel. Gandasari - Jatiuwung,JECC.JK,
10220,Communication Services,664.0,"PT Mahaka Media Tbk, through its subsidiaries, operates as a multiplatform media company in Indonesia and internationally. It engages in making, selling, collecting, and distributing community contents through various platforms. The company publishes Harian Republika Daily, a Moslem newspaper; Republika Penerbit, which specializes in Islamic reference books, novels, and children stories; Golf Digest, a golf media, including e-magazine, e-newsletter, and social media, as well as golfdigest.id, a Website; and Harian Indonesia, a Chinese-language newspaper. It also provides Republika Media Visual, which offers content and program with Islamic background; Jak TV, a television station; and various commercial radio stations, including JAK 101 FM, GEN 98.7 FM Jakarta, GEN 103.1 FM, Surabaya, HOT 93.2 FM, Most Radio 105.8 FM, KIS 95.1 FM, and Mustang 88.0 FM. In addition, the company offers outdoor advertising media services under the Mahaka Advertising name; brand activation services under the Alive Indonesia name; and discount services under the CardPlus name. Further, it provides online services through Jak-tv.co.id, 98.7 GenFM.co.id, 101 JakFM.co.id, and Republika.co.id. The company was formerly known as PT Abdi Bangsa Tbk and changed its name to PT Mahaka Media Tbk in May 2010. PT Mahaka Media Tbk was founded in 1992 and is headquartered in Jakarta, Indonesia. PT Mahaka Media Tbk is a subsidiary of PT Beyond Media.",Jakarta,62 21 573 9203,Indonesia,https://www.mahakamedia.com,86400,Sahid Office Boutique,62 21 573 9210,Publishing,Blok G Jl. Jend Sudirman Kav. 86,ABBA.JK,
10120,Financial Services,614.0,"PT. Verena Multi Finance Tbk provides consumer finance and finance leasing services to individuals and financial institutions in Indonesia. The company offers financing for new and used cars; and investment and working capital financing services, as well as financial leasing for heavy equipment and production machines. It operates through 21 branches in Bandung, Bogor, Cikarang, Depok, Jakarta, Jambi, Kediri, Makassar, Malang, Medan, Palembang, Pekanbaru, Samarinda, Serang, Surabaya, and Tangerang cities. The company was formerly known as PT. Verena Oto Finance Tbk and changed its name to PT. Verena Multi Finance Tbk in January 2011. PT. Verena Multi Finance Tbk was founded in 1993 and is headquartered in Jakarta Pusat, Indonesia. PT. Verena Multi Finance Tbk is a subsidiary of Mizuho Leasing Company, Limited",Jakarta Pusat,62 21 350 4890,Indonesia,https://www.verena.co.id,86400,Bank Panin Building,62 21 350 4891,Credit Services,"3rd Floor Jalan Pecenongan No. 84 Kel. Kebon Kelapa, Kec. Gambir",VRNA.JK,
11560,Industrials,188.0,"PT Wintermar Offshore Marine Tbk supporting services for the offshore transportation for the oil and gas industry in Indonesia, Malaysia, Brunei, Myanmar, Thailand, India, Saudi Arabia, Nigeria, and Taiwan. The company operates through three segments: Charter of Own Vessels, Charter of Third Party Vessels, and Other Services. Its fleet includes platform supply vessels, anchor handling tug supply vessels, anchor handling tug vessels, fast utility vessels, fast multi-purpose supply vessels, azimuth stern drive tugs, utility vessels, heavy load barges, landing crafts, and tug boats. The company also offers rig moving and anchor handling, crew change and rig supply, firefighting and emergency rescue, air diving and remotely operated vehicle support, offshore windfarm installation support, pipe tailing support, seismic survey support, cable laying support, and harbor towage services. It owns and operates 38 vessels. The company was formerly known as PT Swakarya Mulia Shipping and changed its name to PT Wintermar Offshore Marine Tbk in September 2010. PT Wintermar Offshore Marine Tbk was founded in 1970 and is based in West Jakarta, Indonesia.",Jakarta Barat,62 21 530 5201,Indonesia,https://www.wintermar.com,86400,Jalan Kebayoran Lama No 155,62 21 530 5203,Marine Shipping,,WINS.JK,
14350,Financial Services,2411.0,"PT Wahana Ottomitra Multiartha Tbk, together with its subsidiaries, engages in consumer financing activities in Indonesia. The company offers investment financing and working capital financing services, such as finance lease, sale and leaseback, factoring, project financing, and infrastructure financing, as well as purchase payment by installments and other financing services. It also provides financing services for new and used two-wheeled and four-wheeled motor vehicles. The company was formerly known as PT Wahana Ometraco Multi Artha and changed its name to PT Wahana Ottomitra Multiartha Tbk in March 2000. The company was incorporated in 1982 and is headquartered in Jakarta Utara, Indonesia. PT Wahana Ottomitra Multiartha Tbk operates as a subsidiary of PT Bank Maybank Indonesia Tbk.",Jakarta Utara,62 21 2188 2400,Indonesia,https://www.wom.co.id,86400,Altira Office Tower,62 21 2188 2420,Credit Services,"Lt. 32, 33, and 35 Jl. Yos Sudarso Kav. 85 Sunter Jaya, Tanjung Priok",WOMF.JK,
60184,Basic Materials,500.0,"PT Gunawan Dianjaya Steel Tbk produces and sells hot rolled steel plates in Indonesia. It offers steel plates for general use, such as low carbon structural steel plates and high strength low alloy structural steel plates; steel plates for boilers and pressure vessels; and steel plates for ship building, including mild steels and high tensile steels. The company also exports its products. PT Gunawan Dianjaya Steel Tbk was founded in 1989 and is headquartered in Surabaya, Indonesia.",Surabaya,62 31 749 0598,Indonesia,https://www.gunawansteel.com,86400,Jl. Margomulyo No. 29 A,62 31 749 0581,Steel,Tambak Sarioso Asemrowo,GDST.JK,
11520,Financial Services,84.0,"PT Reliance Sekuritas Indonesia Tbk provides securities brokerage and underwriting services in Indonesia. The company was founded in 1993 and is headquartered in Jakarta Barat, Indonesia. PT Reliance Sekuritas Indonesia Tbk is a subsidiary of PT Reliance Capital Management.",Jakarta Barat,62 21 2952 0558,Indonesia,https://www.reliancesekuritas.com,86400,Soho Westpoint,62 21 2911 1951,Capital Markets,Jalan Macan Kav.4-5 Kedoya Utara Kedoya City,RELI.JK,
12940,Communication Services,2070.0,"PT Visi Media Asia Tbk operates as an integrated media convergence company in Indonesia. It operates through Advertisement and Non-Advertisement segments. The company operates tvOne, a news and sports television station; ANTV, which provides entertainment and lifestyle content, such as drama, comedy, animation, and other general entertainment programs for families and children; viva.co.id, a newstainment portal; intipseleb.com, an infotainment portal; jatidangdut.com, a music news portal; sahijab.com, a lifestyle portal; and 100kpj.com, an automotive portal. It also operates vivanews.com, a news portal; milzeru.com, which broadcasts special content for the millennial generation; ANTVklik.com, a news portal; tvOnenews.com, a news and sports portal; vlix.id; and zing.id, a video-on-demand portal. It also offers trading and business management consultancy services; office rental, property management, and other services; internet and website advertising services; multimedia and telecommunication services; general private television broadcasting services; television broadcasting industry services; and production house services. The company was founded in 2004 and is based in Jakarta, Indonesia. PT Visi Media Asia Tbk is a subsidiary of PT Bakrie Global Ventura.",Jakarta,62 21 2253 5575,Indonesia,https://www.vivagroup.co.id,86400,Komplek Rasuna Epicentrum Lot. 9,62 21 2253 5515,Broadcasting,Jl. H.R. Rasuna Said Karet Kuningan Setiabudi District,VIVA.JK,
12190,Industrials,218.0,"PT Dana Brata Luhur Tbk, a coal logistic company, provides pit to port coal hauling services in Indonesia. The company operates hauling roads and stockpile areas. It also operates a coal terminal for coal loading and blending. The company was founded in 2008 and is headquartered in Jakarta, Indonesia. PT Dana Brata Luhur Tbk is a subsidiary of PT Prima Mineral Utama.",Jakarta,62 21 5010 6300,Indonesia,https://www.tebe.co.id,86400,Treasury Tower,62 21 5010 6299,Infrastructure Operations,"15th Floor, Unit H District 8, SCBD Lot 28 Jl. Jend. Sudirman Kav. 52–53",TEBE.JK,
12190,Financial Services,17.0,"PT Fuji Finance Indonesia Tbk operates as a finance company in Indonesia. It offers investment finance for various industrial machineries and equipment, such as power plant equipment, heavy equipment, and all types of vehicles; working capital finance; multipurpose finance for procurement of goods or services; invoice factoring services; bridging finance; and finance for green energy projects, such as solar power system. The company was founded in 1982 and is based in Jakarta, Indonesia. PT Fuji Finance Indonesia Tbk is a subsidiary of Indovalue Capital Asset Management Ltd.",Jakarta,62 21 522 6509,Indonesia,https://www.fujifinance.com,86400,Menara Sudirman,62 21 522 6518,Credit Services,8th Floor Jl. Jend. Sudirman Kav. 60,FUJI.JK,
10220,Utilities,509.0,"PT Rukun Raharja Tbk, together with its subsidiaries, operates as an integrated energy provider in Indonesia. It is involved in the distribution and storage of natural gas and fuel; maintenance and operations of clean water, gas infrastructure, and compression, as well as management of LPG terminal facilities. The company also offers supporting services for oil and natural gas mining; consultations on energy and mining; port services; containers loading-unloading services; leasing and management of building; supporting utilities of property companies; and planning and construction supervision services. In addition, it is involved fuel and gas transmission pipeline capacity trading. The company was founded in 1993 and is headquartered in Jakarta Pusat, Indonesia.",Jakarta Pusat,62 21 2929 1053,Indonesia,https://www.raja.co.id,86400,Office Park Thamrin Residences,61 21 2357 9803,Utilities—Regulated Gas,"Blok A. No. 01-05 Jalan Thamrin Boulevard Kebon. Melati, Tanah Abang",RAJA.JK,
11470,Real Estate,79.0,"PT Triniti Dinamik develops real estate properties in Indonesia. It develops residential and small office home office projects, as well as apartments. The company was founded in 2014 and is based in Grogol Petamburan, Indonesia.",Grogol Petamburan,62 21 2920 1133,Indonesia,https://www.trinitidinamik.com,86400,APL Tower,,Real Estate—Development,"10th Floor, T2 – T9 Jl. Letjen. S.Parman Kav.28",TRUE.JK,
12760,Real Estate,79.0,"PT DMS Propertindo Tbk operates as a property development and hospitality management company in Indonesia. The company constructs residential buildings, civil projects, and other construction installations. It also owns and operates three hotels, including ZEST Hotel, Hotel Indies Heritage, and FABU Hotel; and operates restaurants, a bar, and a spa. The company was founded in 2011 and is headquartered in Jakarta Selatan, Indonesia. PT DMS Propertindo Tbk is a subsidiary of PT DMS Investama.",Jakarta Selatan,62 21 794 0671,Indonesia,https://www.dmspropertindo.com,86400,Gedung Graha Mampang,,Real Estate Services,2nd Floor Jl. Mampang Prapatan No. 100,KOTA.JK,
12940,Financial Services,333.0,"PT Lippo General Insurance Tbk provides various insurance products in Indonesia. The company offers fire, motor vehicles, credit insurance and bonds, marine cargo, health, life and death, and other insurance products. It operates through branches and marketing offices located in Karawaci, Medan, Surabaya, Palembang, Bandung, Semarang, Solo, Pekanbaru, Cikarang, Makassar, Balikpapan, and Bali. The company was formerly known as PT Asuransi Marga Pusaka and changed its name to PT Lippo General Insurance Tbk in July 1991. PT Lippo General Insurance Tbk was founded in 1963 and is headquartered in Jakarta Selatan, Indonesia.",Jakarta Selatan,62 21 525 6161,Indonesia,https://www.lippoinsurance.com,86400,Lippo Kuningan Building,62 21 525 7161,Insurance—Diversified,27th Floor Unit A & F Jl. HR Rasuna Said Kav. B-12,LPGI.JK,
10730,Basic Materials,18.0,"PT Wilton Makmur indonesia Tbk., together with its subsidiaries, engages in the exploration and mining of gold in Indonesia. The company holds interest in the Ciemas Gold Project that covers a total area of 3,078.5 hectares located in West Java, Indonesia. It is also involved in the trading of various natural resources, such as zirconium, lead, and coal. The company was formerly known as PT Renuka Coalindo Tbk and changed its name to PT Wilton Makmur indonesia Tbk. in October 2019. The company was founded in 2000 and is headquartered in Jakarta, Indonesia. PT Wilton Makmur indonesia Tbk. is a subsidiary of Wilton Resources Holding Pte. Ltd.",Jakarta,62 21 612 5588,Indonesia,https://www.wilton.id,86400,Komplek Harco Mangga Dua,62 21 612 5583,Gold,(Agung Sedayu) Blok C number 5a Jalan Mangga Dua Raya,SQMI.JK,
12930,Energy,284.0,"PT Atlas Resources Tbk, together with its subsidiaries, engages in the acquisition, exploration, development, production, and sale of coal in Indonesia and internationally. It produces high-calorie and metallurgical coal for use in the steel production and power plants, cement factories, and other manufacturing facilities. The company holds various mining concessions covering a total area of approximately 50,000 hectares in Indonesia. It is also involved in the trading, services, construction, transportation, workshop, printing, investment, logistics, and agricultural activities. The company was founded in 2007 and is based in Jakarta Selatan, Indonesia.",Jakarta Selatan,,Indonesia,https://www.atlas-coal.co.id,86400,Sampoerna Strategic Square,,Thermal Coal,"South Tower, Level 18 Jalan Jenderal Sudirman Kav. 45 - 46",ARII.JK,
10220,Basic Materials,627.0,"PT. Polychem Indonesia Tbk engages in the chemical and polyester businesses. The company operates through Polyester and Petrochemical segments. It offers mono-ethylene glycol, di-ethylene glycol, tri-ethylene glycol, and various ethoxylate products; and petrochemicals. The company also provides polyester chips, partially oriented yarns, polyester staple fibers, and drawn textured yarns. PT. Polychem Indonesia Tbk was founded in 1978 and is headquartered in Jakarta, Indonesia.",Jakarta,62 21 574 4848,Indonesia,https://www.polychemindo.com,86400,Gedung Wisma 46 Kota BNI,62 21 5794 5831,Specialty Chemicals,"Lt 20, RT.010 RW.009 Jl. Jend. Sudirman Kavling 1 Karet Tengsin Tanah Abang, Kota Adm.",ADMG.JK,
12940,Consumer Defensive,1600.0,"PT Budi Starch & Sweetener Tbk, together with its subsidiaries, produces and sells cassava-based products in Indonesia and internationally. The company offers tapioca and modified tapioca starch for use in food, paper, confectionery, chemicals, and instant noodles; and sweeteners, such as glucose, fructose, sorbitol, and maltodextrine. It also provides polypropylene woven bags for packaging applications; sulfuric acid for use in fertilizer manufacturing industries, rayon, dyes, medicines, detergents, inorganic salts, oil refineries, and metallurgical processes; citric acid and other chemicals; and organic fertilizers. The company was formerly known as PT Budi Acid Jaya Tbk and changed its name to PT Budi Starch & Sweetener Tbk in July 2013. PT Budi Starch & Sweetener Tbk was founded in 1979 and is headquartered in Jakarta Selatan, Indonesia.",Jakarta Selatan,62 21 521 3383,Indonesia,https://budistarchsweetener.com,86400,Wisma Budi,62 21 521 3392,Packaged Foods,8th-9th Floor Jl. H.R. Rasuna Said Kav. C-6,BUDI.JK,
12920,Real Estate,310.0,"PT Duta Anggada Realty Tbk. engages in the real estate development activities in Indonesia. It develops, sells, rents, and manages apartments, office buildings, hotels, and shopping centers in Jakarta and Bali. The company also provides tourism hospitality and other related services. The company was formerly known as PT Duta Anggada Inti Pratama and changed its name to PT Duta Anggada Realty Tbk. in April 1997. PT Duta Anggada Realty Tbk. was founded in 1983 and is headquartered in Jakarta, Indonesia.",Jakarta,62 21 520 8000,Indonesia,https://www.dutaanggadarealty.com,86400,Chase Plaza Building,62 21 520 8100,Real Estate Services,Lantai 21 Jalan Jenderal Sudirman Kav. 21,DART.JK,
15321,Consumer Cyclical,2588.0,"PT Industri dan Perdagangan Bintraco Dharma Tbk, together with its subsidiaries, engages in automotive sales and after sales services, and financing businesses. It operates through three segments: Automotive, Financing, and After Sales. The company sells new vehicles; and offers sales and after-sales services for new vehicles through 24 marketing branch offices and official workshops, as well as provides financing services. It is also involved in the distribution of spare parts for four-wheeled and two-wheeled motor vehicles; development of car maintenance workshops networks under the CARfix brand; trading business; building rental; provision of vehicle repair services; and motorcycles dealing. In addition, the company operates CARSWORLD, a car ecosystem platform that allows users to maintain, sell, buy, finance, auction, and insure their cars and pay their transactions. PT Industri dan Perdagangan Bintraco Dharma Tbk was incorporated in 1969 and is headquartered in Tangerang Selatan, Indonesia.",Tangerang Selatan,62 21 2235 6800,Indonesia,https://www.bintracodharma.com,86400,Gedung CARSWORLD Lantai 8,62 21 2235 6801,Auto & Truck Dealerships,Jalan Sunburst CBD Lot II No. 3 BSD City Serpong,CARS.JK,
12740,Industrials,189.0,"PT Keramika Indonesia Assosiasi Tbk produces and sells various ceramic products in Indonesia, Asia, Europe, and the United States. The company offers floor, wall, granite, roof, and vinyl tiles; sanitary ware products, such as toilet products and wash bowls; and sanitary fittings, including showers, faucets, mixer stop valves, bath mixers, floor drain squares, and kitchen faucets. It provides its products under the KIA, IMPRESSO, and SPECTRA brands. The company was founded in 1953 and is headquartered in Jakarta Selatan, Indonesia. PT Keramika Indonesia Assosiasi Tbk is a subsidiary of SCG Building Materials Co., Ltd.",Jakarta Selatan,62 21 799 3973,Indonesia,https://www.kiaceramics.com,86400,Graha Mobisel,,Building Products & Equipment,"3rd Floor Jalan Warung Buncit Raya No.139 Kalibata, Pancoran",KIAS.JK,
15720,Consumer Defensive,,"PT Pratama Abadi Nusa Industri Tbk manufactures and sells packaging cans. The company primarily offers blek cans for glue, paints, and oil packaging. It also engages in the processing of fishery products and freezing food, as well as provides cold storage services. The company was founded in 2000 and is headquartered in Tangerang, Indonesia. PT Pratama Abadi Nusa Industri Tbk is a subsidiary of PT Multi Artha Pratama.",Tangerang,62 21 2941 7685,Indonesia,https://www.pratamaabadi.com,86400,Jalan Aria Jaya Sentika,62 21 2941 7685,Packaged Foods,No.33 RT. 001/001 Desa Pasir Bolang Kecamatan Tigaraksa,PANI.JK,
12950,Industrials,1014.0,"PT Voksel Electric Tbk, together with its subsidiaries, manufactures and sells power and telecommunication cables in Indonesia. It operates through Power Cable, Fiber Optic Cable, Copper Wire Cable, Contractor Service, and Trading segments. The company provides bare copper and aluminum conductors; and power and control cables, such as high and medium voltage, submarine, low voltage, cross linked polyethylene insulated, polyethylene insulated, polyvinyl chloride insulated, fire resistance, control and instrument, shipyard, and solar cables. It also offers optical fiber cables, which include all dielectric self supporting cables, aerial and duct cables, armor/buried cables, fiber to the home and single core per tube cables, air blowing micro duct cables, submarine fiber optic cables, and optical ground wires. In addition, the company is involved in trading of machinery, telecommunications equipment, and other equipment. Further, it exports its products. PT Voksel Electric Tbk was founded in 1971 and is headquartered in Jakarta, Indonesia.",Jakarta,62 21 5794 4622,Indonesia,https://www.voksel.co.id,86400,Menara Karya Lantai 3,62 21 5794 4649,Electrical Equipment & Parts,"Suite D Block X-5, Kav. 1-2 Jl. HR. Rasuna Said",VOKS.JK,
10310,Financial Services,15.0,"PT Buana Artha Anugerah Tbk operates as an asset management company in Indonesia. The company offers investment management products, such as mutual funds and fixed income securities. It also engages in the trading business. The company was formerly known as PT Star Petrochem, Tbk and changed its name to PT Buana Artha Anugerah Tbk in June 2019. PT Buana Artha Anugerah Tbk was founded in 2008 and is based in Central Jakarta, Indonesia.",Jakarta Pusat,62 21 2358 5612,Indonesia,https://www.starpetrochem.co.id,86400,Menara BCA,62 21 2358 4401,Asset Management,Lt. 45 Grand Indonesia Jl. MH Thamrin No. 1,STAR.JK,
17550,Industrials,196.0,"PT Multifiling Mitra Indonesia Tbk provides integrated storage and record management services in Indonesia. It offers document scanning and digital storage; secure shredding; IT asset recycling and disposition; and legal and vital records storage services. The company also provides Iron Mountain Clean Start that navigates changing workplace requirements from dedensifying and reconfiguring the office for social distancing to office closures or moving to digital way of working; and file room, and offsite records and tape vaulting solutions. In addition, it offers Mountain Connect, an online hub to find records at any time. The company was founded in 1992 and is headquartered in Bekasi, Indonesia. PT Multifiling Mitra Indonesia Tbk is a subsidiary of Iron Mountain Hong Kong Limited.",Bekasi,62 21 8990 7636,Indonesia,https://www.mmi.co.id,86400,Delta Silicon Industrial Park,62 21 897 2652,Specialty Business Services,Jl. Akasia II Blok A7-4A Lippo Cikarang,MFMI.JK,
